{
  "checkpoints": [
    {
      "adaptation": {
        "accuracy_change": 0.0,
        "expected_calibration_error": 0.9725306814719611,
        "macro_f1": 0.01092896174863388,
        "negative_log_likelihood": 7.275853031347718,
        "sample_count": 90,
        "top1_accuracy": 0.011111111111111112
      },
      "dataset_fingerprints": {
        "adaptation": "ad16b844fe7a1de9ec74af471f73b97af3426753b8f7b6d667d02ba616babeef",
        "retained": "5a3bfb7b5a9bd7afe628f1bc95571b9df87c41e4731ed66d21dd9f6bdc105094"
      },
      "geometry": {
        "adaptation": {
          "class_centroid_movement": {
            "0": 0.0,
            "1": 0.0,
            "2": 0.0
          },
          "cosine_centroid_drift": 0.0,
          "effective_rank": 1.9993211659817067,
          "frechet_distance": 4.440892098500626e-16,
          "linear_cka": 0.9999999999999996,
          "neighborhood_overlap_at_5": 1.0
        },
        "retained": {
          "class_centroid_movement": {
            "0": 0.0,
            "1": 0.0,
            "2": 0.0
          },
          "cosine_centroid_drift": 1.1102230246251565e-16,
          "effective_rank": 1.9992227226889965,
          "frechet_distance": 0.0,
          "linear_cka": 0.9999999999999993,
          "neighborhood_overlap_at_5": 1.0
        }
      },
      "retained": {
        "accuracy_change": 0.0,
        "expected_calibration_error": 3.207617803147045e-06,
        "macro_f1": 1.0,
        "negative_log_likelihood": 3.2076397304630385e-06,
        "sample_count": 90,
        "top1_accuracy": 1.0
      },
      "samples": {
        "adaptation": [
          {
            "baseline": [
              0.8503982424736023,
              -0.5261396169662476
            ],
            "current": [
              0.8503982424736023,
              -0.5261396169662476
            ],
            "id": 0,
            "label": 2
          },
          {
            "baseline": [
              -0.17567645013332367,
              0.9844479560852051
            ],
            "current": [
              -0.17567645013332367,
              0.9844479560852051
            ],
            "id": 1,
            "label": 0
          },
          {
            "baseline": [
              0.9520167112350464,
              -0.3060459792613983
            ],
            "current": [
              0.9520167112350464,
              -0.3060459792613983
            ],
            "id": 2,
            "label": 2
          },
          {
            "baseline": [
              -0.7285468578338623,
              -0.6849959492683411
            ],
            "current": [
              -0.7285468578338623,
              -0.6849959492683411
            ],
            "id": 3,
            "label": 1
          },
          {
            "baseline": [
              0.985291600227356,
              0.17088158428668976
            ],
            "current": [
              0.985291600227356,
              0.17088158428668976
            ],
            "id": 4,
            "label": 2
          },
          {
            "baseline": [
              0.7357828617095947,
              -0.6772174835205078
            ],
            "current": [
              0.7357828617095947,
              -0.6772174835205078
            ],
            "id": 5,
            "label": 2
          },
          {
            "baseline": [
              0.9999479055404663,
              -0.01020652987062931
            ],
            "current": [
              0.9999479055404663,
              -0.01020652987062931
            ],
            "id": 6,
            "label": 2
          },
          {
            "baseline": [
              -0.5790083408355713,
              -0.8153216242790222
            ],
            "current": [
              -0.5790083408355713,
              -0.8153216242790222
            ],
            "id": 7,
            "label": 1
          },
          {
            "baseline": [
              0.4323299825191498,
              0.9017153978347778
            ],
            "current": [
              0.4323299825191498,
              0.9017153978347778
            ],
            "id": 8,
            "label": 0
          },
          {
            "baseline": [
              0.9091621041297913,
              -0.4164424240589142
            ],
            "current": [
              0.9091621041297913,
              -0.4164424240589142
            ],
            "id": 9,
            "label": 2
          },
          {
            "baseline": [
              -0.9290751814842224,
              -0.36989080905914307
            ],
            "current": [
              -0.9290751814842224,
              -0.36989080905914307
            ],
            "id": 10,
            "label": 1
          },
          {
            "baseline": [
              -0.884084939956665,
              -0.46732622385025024
            ],
            "current": [
              -0.884084939956665,
              -0.46732622385025024
            ],
            "id": 11,
            "label": 1
          },
          {
            "baseline": [
              0.9711843132972717,
              -0.23832957446575165
            ],
            "current": [
              0.9711843132972717,
              -0.23832957446575165
            ],
            "id": 12,
            "label": 2
          },
          {
            "baseline": [
              -0.26151570677757263,
              0.9651992321014404
            ],
            "current": [
              -0.26151570677757263,
              0.9651992321014404
            ],
            "id": 13,
            "label": 0
          },
          {
            "baseline": [
              0.9533782601356506,
              -0.3017778694629669
            ],
            "current": [
              0.9533782601356506,
              -0.3017778694629669
            ],
            "id": 14,
            "label": 2
          },
          {
            "baseline": [
              0.16212427616119385,
              0.9867703318595886
            ],
            "current": [
              0.16212427616119385,
              0.9867703318595886
            ],
            "id": 15,
            "label": 0
          },
          {
            "baseline": [
              -0.7802616357803345,
              -0.6254532933235168
            ],
            "current": [
              -0.7802616357803345,
              -0.6254532933235168
            ],
            "id": 16,
            "label": 1
          },
          {
            "baseline": [
              -0.3629201650619507,
              0.931820273399353
            ],
            "current": [
              -0.3629201650619507,
              0.931820273399353
            ],
            "id": 17,
            "label": 0
          },
          {
            "baseline": [
              -0.29921260476112366,
              0.9541864991188049
            ],
            "current": [
              -0.29921260476112366,
              0.9541864991188049
            ],
            "id": 18,
            "label": 0
          },
          {
            "baseline": [
              -0.6598880290985107,
              -0.75136399269104
            ],
            "current": [
              -0.6598880290985107,
              -0.75136399269104
            ],
            "id": 19,
            "label": 1
          },
          {
            "baseline": [
              0.9483456611633301,
              -0.31723880767822266
            ],
            "current": [
              0.9483456611633301,
              -0.31723880767822266
            ],
            "id": 20,
            "label": 2
          },
          {
            "baseline": [
              -0.12018433213233948,
              0.9927515983581543
            ],
            "current": [
              -0.12018433213233948,
              0.9927515983581543
            ],
            "id": 21,
            "label": 0
          },
          {
            "baseline": [
              -0.203287735581398,
              0.979119062423706
            ],
            "current": [
              -0.203287735581398,
              0.979119062423706
            ],
            "id": 22,
            "label": 0
          },
          {
            "baseline": [
              0.7236660122871399,
              -0.6901503801345825
            ],
            "current": [
              0.7236660122871399,
              -0.6901503801345825
            ],
            "id": 23,
            "label": 2
          },
          {
            "baseline": [
              -0.3477481007575989,
              0.9375879764556885
            ],
            "current": [
              -0.3477481007575989,
              0.9375879764556885
            ],
            "id": 24,
            "label": 0
          },
          {
            "baseline": [
              -0.7693440318107605,
              -0.6388346552848816
            ],
            "current": [
              -0.7693440318107605,
              -0.6388346552848816
            ],
            "id": 25,
            "label": 1
          },
          {
            "baseline": [
              0.07806281745433807,
              0.9969484806060791
            ],
            "current": [
              0.07806281745433807,
              0.9969484806060791
            ],
            "id": 26,
            "label": 0
          },
          {
            "baseline": [
              -0.11888305842876434,
              0.992908239364624
            ],
            "current": [
              -0.11888305842876434,
              0.992908239364624
            ],
            "id": 27,
            "label": 0
          },
          {
            "baseline": [
              -0.2671199440956116,
              0.9636633396148682
            ],
            "current": [
              -0.2671199440956116,
              0.9636633396148682
            ],
            "id": 28,
            "label": 0
          },
          {
            "baseline": [